{
  "company_portfolio": {
    "owner": "Young Entrepreneur (Age 12)",
    "business_model": "Multi-platform AI-powered business solutions",
    "target_markets": ["Business owners", "Families with kids", "Financial professionals", "Fashion enthusiasts"],
    "mission": "Democratizing AI technology across industries while maintaining safety and educational value",
    "vision": "To become the leading provider of accessible AI solutions for businesses and families worldwide",
    "core_values": ["Innovation", "Education", "Safety", "Creativity", "Accessibility", "Results"]
  },
  
  "websites": [
    {
      "name": "4rge4business",
      "url": "https://4rge4business.com",
      "description": "AI-Powered Business Solutions & B2B Automation",
      "target_audience": "Small to medium business owners, entrepreneurs",
      "key_services": [
        "Complete AI ecosystems for business",
        "SaaS subscriptions",
        "Done-for-you implementations",
        "Business automation solutions"
      ],
      "unique_selling_points": [
        "Delivers measurable ROI",
        "Transforms how businesses operate, compete, and grow",
        "Complete AI ecosystem solutions",
        "Industry and function-specific solutions"
      ],
      "call_to_action": "Explore Solutions and View Demo",
      "pricing_model": "SaaS subscriptions and enterprise packages",
      "priority": "high",
      "conversion_goals": ["demo_requests", "subscription_signups", "enterprise_inquiries"]
    },
    
    {
      "name": "Token4rge",
      "url": "https://www.token4rge.com",
      "description": "AI-Driven Tools - Empowering Innovation with AI Solutions for Every Industry",
      "target_audience": "Businesses needing AI automation, crypto traders, startups, marketing professionals, entrepreneurs",
      "key_services": [
        "Multi-Platform Social Media Agent ($50/week)",
        "AI Call Support Agent ($60/month)",
        "AI Advertising Agent ($100/week)", 
        "Advanced Marketing Agent ($100/week)",
        "Arbitrage Bot Pro ($200/week)",
        "Web Dev Agent ($300/site+)",
        "Token Contract Auditor ($5/audit)",
        "SEO Audit Agent ($100/audit)",
        "AI Startup Auditor ($699/report)"
      ],
      "unique_selling_points": [
        "No coding or crypto expertise needed",
        "AI agents that automate workflows and secure data",
        "Industry-specific solutions (retail, healthcare, logistics)",
        "Streamlines operations and protects intellectual property",
        "Personalizes customer engagement",
        "Scale smarter, innovate faster, future-proof business"
      ],
      "call_to_action": "Buy AI tools and agents to automate your business",
      "pricing_model": "Pay-per-service and subscription-based AI tools",
      "status": "Live with 9+ AI tools available",
      "priority": "high",
      "conversion_goals": ["tool_purchases", "subscription_signups", "service_bookings"]
    },
    
    {
      "name": "Kids Adventure Zone",
      "url": "https://kidsadventurezone.com",
      "description": "Amazing AI Tools for Kids - Educational Games & Creative Learning",
      "target_audience": "Parents and teachers looking for educational AI tools for kids aged 6-13",
      "key_services": [
        "Magic Drawing AI Buddy - animated drawings",
        "Story Kingdom Builder - interactive storytelling",
        "Time Machine Explorer - historical adventures",
        "Virtual Science Lab - safe experiments",
        "Beat Maker Genius - music creation",
        "Educational games and tools"
      ],
      "unique_selling_points": [
        "100% safe environment for kids",
        "Educational and entertaining",
        "Sparks creativity and imagination",
        "Kid-friendly interfaces",
        "AI-powered learning tools"
      ],
      "pricing": {
        "free": "$0/month - Try all tools (limited), 5 creations per day",
        "premium": "$9.99/month - Unlimited everything, premium features",
        "white_label": "$49.99/month - Custom branding, admin dashboard"
      },
      "call_to_action": "Start Your Adventure! Join the fun learning experience",
      "priority": "high",
      "conversion_goals": ["free_signups", "premium_upgrades", "white_label_sales"]
    },
    
    {
      "name": "Financial Doc Converter",
      "url": "https://financialdocconverter.com",
      "description": "AI-Powered Financial Document Converter & Analyzer",
      "target_audience": "Financial analysts, small business owners, accountants, professionals",
      "key_services": [
        "Universal document conversion (PDF, Excel, CSV, Word)",
        "Smart expense categorization",
        "Trend analysis and insights",
        "Expense breakdowns with visual charts",
        "Bank-grade security",
        "Instant AI processing"
      ],
      "unique_selling_points": [
        "AI automatically categorizes expenses and transactions",
        "Discover spending patterns and trends",
        "Enterprise-level encryption and security",
        "Lightning-fast processing with accuracy",
        "Supports all major document formats"
      ],
      "call_to_action": "Transform Your Financial Documents - No credit card required",
      "pricing_model": "Freemium with Pro upgrade (50% OFF currently)",
      "priority": "high",
      "conversion_goals": ["free_trials", "pro_upgrades", "document_conversions"]
    },
    
    {
      "name": "Marathon of Dope",
      "url": "https://www.marathonofdopetf.com/",
      "description": "Dope on Demand - Streetwear meets creativity",
      "target_audience": "Fashion enthusiasts, streetwear lovers, creative individuals",
      "key_services": [
        "Custom streetwear collections",
        "Dope-on-demand fashion",
        "Creative streetwear designs",
        "Fashion brand evolution"
      ],
      "unique_selling_points": [
        "Where streetwear meets creativity",
        "Custom collections made just for you",
        "No limits, no compromisesâ€”just pure dope",
        "Evolution of a project turned brand"
      ],
      "call_to_action": "Explore our dope-on-demand collections",
      "status": "PHASE 4 - Brand evolution in progress",
      "priority": "medium",
      "conversion_goals": ["collection_views", "custom_orders", "brand_engagement"]
    }
  ],
  
  "brand_guidelines": {
    "overall_voice": "Innovative, young entrepreneur, tech-savvy, customer-focused",
    "tone_keywords": ["innovative", "AI-powered", "user-friendly", "transformative", "creative", "safe", "professional"],
    "avoid_words": ["complicated", "expensive", "limited", "basic", "outdated"],
    "brand_values": ["Innovation", "Education", "Safety", "Creativity", "Accessibility", "Results"],
    "target_demographics": {
      "primary": "Business owners, parents, financial professionals",
      "secondary": "Educators, developers, fashion enthusiasts",
      "age_ranges": "All ages - from kids to business professionals"
    },
    "messaging_framework": {
      "problem": "Businesses struggle with complex AI implementation and families need safe educational technology",
      "solution": "Accessible, safe, and powerful AI tools for every industry and age group",
      "proof": "Proven ROI, educational value, and user satisfaction across diverse markets"
    }
  },
  
  "technical_config": {
    "api_integrations": {
      "social_media": ["Facebook", "Twitter", "LinkedIn", "Instagram", "TikTok"],
      "email_platforms": ["SendGrid", "Mailchimp", "ConvertKit"],
      "analytics": ["Google Analytics", "Mixpanel", "Hotjar"],
      "payment_processing": ["Stripe", "PayPal", "Square"],
      "crm_systems": ["HubSpot", "Salesforce", "Pipedrive"]
    },
    "content_management": {
      "cms_platforms": ["WordPress", "Webflow", "Custom CMS"],
      "asset_storage": ["AWS S3", "Cloudinary", "Google Cloud Storage"],
      "cdn_providers": ["Cloudflare", "AWS CloudFront"]
    },
    "automation_tools": {
      "marketing_automation": ["Zapier", "Make", "Custom webhooks"],
      "social_scheduling": ["Buffer", "Hootsuite", "Later"],
      "email_sequences": ["Drip campaigns", "Behavioral triggers", "Segmentation"]
    },
    "seo_technical": {
      "tracking_codes": {
        "google_analytics": "GA4-XXXXXXXXX",
        "google_tag_manager": "GTM-XXXXXXX",
        "facebook_pixel": "XXXXXXXXXXXXXXXXX"
      },
      "schema_markup": ["Organization", "Product", "Service", "FAQ", "Review"],
      "site_speed_optimization": ["Image compression", "Lazy loading", "CDN", "Minification"]
    }
  },
  
  "agent_configurations": {
    "content_strategist": {
      "focus_areas": ["AI business solutions", "Educational technology", "Financial tools", "Fashion trends"],
      "content_types": ["Blog posts", "Case studies", "Tutorials", "Product descriptions"],
      "tone_adaptation": {
        "4rge4business": "Professional, results-focused, ROI-driven",
        "token4rge": "Technical but accessible, innovation-focused",
        "kidsadventurezone": "Fun, safe, educational, parent-friendly",
        "financialdocconverter": "Professional, trustworthy, security-focused",
        "marathonofdope": "Creative, edgy, authentic, street-smart"
      }
    },
    "social_media_orchestrator": {
      "platform_strategies": {
        "LinkedIn": "B2B focus, thought leadership, business solutions",
        "Facebook": "Family-friendly, educational content, community building",
        "Instagram": "Visual storytelling, behind-the-scenes, fashion content",
        "Twitter": "Tech updates, industry insights, quick tips",
        "TikTok": "Educational content for kids, creative demos"
      },
      "posting_schedules": {
        "business_hours": "9 AM - 5 PM EST",
        "peak_engagement": ["12 PM - 1 PM", "5 PM - 6 PM", "8 PM - 9 PM"],
        "frequency": "3-5 posts per day across platforms"
      }
    },
    "seo_domination": {
      "keyword_strategies": {